{
  "benchmark_id": "<benchmark-id>",
  "candidate_id": "<candidate-id>",
  "candidate_artifact": "optimizer/dspy",
  "run_kind": "automated",
  "source_kind": "optimizer_generated",
  "summary": "DSPy-generated candidate run.",
  "notes": "Generated from results/optimizer-dataset.json and intended for v2 scoring."
}
